Judul,Keterangan
"Polisi Tangkap Pengedar Narkoba di Bojonggede, Bungkus Ganja Pakai Kertas Nasi",NonClickbait
Warga yang Bantu 6 Oknum POM AL Tewaskan Pencuri di Purwakarta Ditangkap,NonClickbait
"Gugatan Ditolak MK, Begini Tanggapan Arsyad Kasmar",Clickbait
Kronologi Wanita Bersuami Tewas Kejang-kejang Saat Berhubungan Intim dengan Selingkuhan,NonClickbait
"Guru Muda di Asahan Rudapaksa Muridnya, Begini Modusnya",Clickbait
"Jika Pensiun dari MotoGP, ke Mana Rossi Akan Lampiaskan Hasrat Balap?",Clickbait
"UPDATE Calon Kabareskrim: Masih Diproses Wanjakti, 4 Irjen Berpeluang, hingga Muncul Nama Karyoto",NonClickbait
"Pembegal di Percutseituan Medan Tewas Diamuk Massa, Begini Cerita Lengkap Korbannya",Clickbait
China Dituduh Pihak yang Pertama Kali Sebarkan Konspirasi Mengenai Covid-19,NonClickbait
"Sedang Hamil Tua, Seorang Ibu Rumah Tangga Kena Peluru Nyasar, Kondisinya Kian Membaik",NonClickbait
Peretas Korea Utara Coba Mencuri Informasi Vaksin Pfizer,NonClickbait
"Kapolri Ingin Pelapor UU ITE Harus Korban, Tak Bisa Diwakilkan",NonClickbait
"Barca Digasak PSG: Pique Ngamuk, Griezmann Kena Damprat Juga!",Clickbait
Ketua Komisi III DPR: Komjen Agus Andrianto Dijagokan Jadi Kabareskrim,NonClickbait
"Pilot Cantik Athira Farina Alami Kecelakaan, Mobilnya Terbakar",NonClickbait
Mbappe Penuh Aksi Vs Messi Jalan Kaki,NonClickbait
"Turun Terus, Harga Emas Antam di Titik Terendah dalam 6 Bulan",NonClickbait
Viral Video Ambulans Pasien COVID-19 Dihalangi Mobil di Bandung,Clickbait
Kantor Gubernur Aceh Dikirimi Karangan Bunga 'Juara Termiskin di Sumatera',NonClickbait
'Neraka' Tujuh Bulan Terakhir Barcelona,NonClickbait
Jokowi hingga Anies Pantau Vaksinasi COVID-19 di Pasar Tanah Abang,NonClickbait
"RI Ditargetkan Bebas Corona 17 Agustus, Realistis? Ini Tanggapan Pakar IDI",Clickbait
"Tak Perlu Tunggu SMS, Registrasi Penerima Vaksin Corona Bisa Pakai KTP",NonClickbait
"8 Tingkah Kocak Netizen 'Terinfeksi Demam Ikatan Cinta', Bikin Geleng Kepala",Clickbait
"King of Speed, Ini 8 Motor Tercepat di Dunia",Clickbait
"Zona Merah Corona Bertambah, Jateng dan Bali Terbanyak",NonClickbait
"Mobil City Car Suzuki Ini Tampil Gaya Ala Bugatti Veyron, Dijual Rp 75 Jutaan",Clickbait
"Buntut Kerumunan Imlek di Pantai Reklamasi, Pantjoran PIK Disegel",NonClickbait
Mandalika Racing Team Ungkap Alasan Dimas Ekky Gagal Tampil di Moto2,NonClickbait
Deretan Foto Bukti Manusia Adalah Makhluk yang Ceroboh,NonClickbait
"Xiaomi Redmi 9T Meluncur 22 Februari di Indonesia, Ini Kisaran Harganya",Clickbait
Penolakan Pemerintah Revisi UU Pemilu dan Bantahan Terkait Anies atau Gibran...,NonClickbait
"Paham, Kebutuhan Cahaya Matahari untuk Tanaman di Dalam Rumah",NonClickbait
"Andika Mahesa Bongkar Kebaikan Ruben Onsu, Selalu Kirim Uang untuk Chacha",Clickbait
"Migrant Worker's Fight Against Chronic Trauma",NonClickbait
"Tonton Laga Barcelona Vs PSG, Khabib Nurmagomedov Dapat Jersey Bersejarah Kylian Mbappe",NonClickbait
Dua Pencuri Ditangkap karena Ketiduran di Dalam Mobil,NonClickbait
100 Personel Brimob Jambi Dikirim ke Papua untuk Bantu Menangani KKB,NonClickbait
"8 Permen Khas Indonesia yag Mulai Langka, Bikin Kangen",Clickbait
"Membela Isu Feminisme di Lingkungan Patriarkis Itu Sulit, Apalagi Jika Anda Laki-Laki",NonClickbait
"Usai Tak Menjabat Bupati Blora, Djoko Nugroho Fokus Urus Keluarga",NonClickbait
"Sinopsis It's a Sin, Tayang 18 Februari di HBO Max",NonClickbait
"Seorang ART Kelaparan Makan Sisa Sampah Dekat Pizza Hut, Keluar Rumah Majikan Lompat dari Lantai 2",NonClickbait
150 KK di Kota Padang Mengalami Kekeringan dan Butuh Air Bersih,NonClickbait
Digital Ecosystem not yet Established,NonClickbait
Polemik Baru Nindy dan Askara soal Tudingan Culik Sopir dan Suster,NonClickbait
"Tiga Lokasi di Cipinang Melayu Masih Kebanjiran, Ini Komentar Lurah",Clickbait
11 Penyebab Retensi Air Dalam Tubuh yang Perlu Diwaspadai,Clickbait
Warga Bekasi Geger! Terduga Teroris yang Ditangkap Densus Ternyata Imam Masjid,Clickbait
"RSUD Dr Iskak Tulungagung Cari 285 Pegawai Baru, Berikut Posisi, Syarat hingga Cara Daftarnya!",Clickbait
"Ilmuwan Temukan Cara Ungkap Kehidupan di Planet Lain, Seperti Apa?",Clickbait
"Permudah Pelanggan Beli Emas, Galeri 24 Luncurkan Aplikasi Mobile",NonClickbait
"Banjir Semarang, Momentum Penanganan Terpadu Bencana Pantura",NonClickbait
Wapres Ma'ruf Amin Hari Ini Disuntik Vaksin Covid-19,NonClickbait
"""Kita Mampu Gulingkan Rezim"", Suara Mereka Yang Menolak Tunduk di Myanmar",NonClickbait
Demokrat Pertanyakan Jokowi Tolak RUU Pemilu Tapi Lempar Wacana Revisi UU ITE,NonClickbait
"Pertama Kalinya, China Salip Amerika Serikat Jadi Mitra Dagang Utama Eropa",NonClickbait
Tujuh Hal Kontroversial Soal UU Separatisme Prancis yang Dinilai Anti-Muslim,Clickbait
"Pesona Briptu Sefin, Polwan Kelewat Cantik Ternyata Punya Adik Polisi Ganteng",Clickbait
Begini Kondisi Kampung Miliarder di Tuban Usai Warganya Barengan Beli Mobil Baru,Clickbait
"Aplikasi Clubhouse Meroket, Jejaring Sosial Eksklusif",NonClickbait
"Heboh Tamara Bleszynski Gendong Bayi Cantik nan Menggemaskan, Banjir Ucapan Selamat",Clickbait
"Potret Crazy Rich Malang Bagi-Bagi Mobil BMW buat Karyawan, Ramai Disebut Bos Terbaik",Clickbait
"Bilang Ariel Goyang di Dalam Kamar Wow, Ucapan Maia Estianty Dianggap Menyebalkan",Clickbait
"Gejala Mirip Penyakit Lain, Waspadai Terjadinya Kanker Lambung",NonClickbait
Penentang Kudeta Militer Myanmar Serukan Aksi Unjuk Rasa yang Lebih Besar,NonClickbait
Ahmad Taufan Damanik: Melindungi HAM Bagian dari Peran Penting TNI,NonClickbait
Tiga Mahasiswi Dilaporkan Hilang di Gunung Masurai Merangin Jambi,NonClickbait
Pimpinan DPR Sangat Setuju Usul Menpan RB Persingkat Libur Idulfitri Hingga Tahun Baru,NonClickbait
Fakta-fakta Wanita Tewas Setelah 20 Menit Berhubungan Intim dengan Selingkuhan yang Berumur 66 Tahun,NonClickbait
Satu Orang Tersiram Minyak Goreng Saat Mobil yang Tawarkan Tahu Bulat Hantam Pohon di Sukabumi,NonClickbait
Kemendikbud Beberkan Syarat Peningkatan Prodi D3 Menjadi Sarjana Terapan,NonClickbait
"16,9 Juta Pekerja Publik dan 21,5 Juta Lansia akan Vaksinasi Tahap 2",NonClickbait
"Panduan Pendaftaran , Segera Login dengan Akun LTMPT di portal.ltmpt.ac.id",NonClickbait
"Din Syamsuddin Ditunding Radikal, Perantauan Sumbawa di Jakarta Minta Jokowi untuk Lakukan Ini",Clickbait
Sidang Gugatan Fredrich Yunadi kepada Setnov Kembali Digelar Siang Ini,NonClickbait
500 Kilogram Kopi Boyolali Tembus Pasar Eropa,NonClickbait
"Asyik Nonton TV dengan Suami, Wanita Hamil 8 Bulan Terkena Peluru Nyasar, Terluka di Pelipis Dahi",NonClickbait
Bamsoet Dukung PLN Beri Diskon Tarif Listrik Bagi Pemilik Kendaraan Listrik,NonClickbait
"Penemuan Mayat Ibu dan Anaknya di Kolong Tempat Tidur, Terdapat Ceceran Darah dalam Rumah",NonClickbait
Pengembang Aplikasi Digital di Afrika Berkembang Selama Pandemi Corona,NonClickbait
"Telepon Menlu RI, Blinken Puji Kepemimpinan Retno Marsudi",NonClickbait
"Kawanan Monyet di India Culik Dua Bayi Kembar Berumur 8 Hari, Satu Bayi Akhirnya Tewas",NonClickbait
Mensos Nilai Warga di Lokasi Longsor Nganjuk Perlu Direlokasi,NonClickbait
Daftar Harta Kekayaan Antonius NS Kosasih yang Setahun Menjabat sebagai Direktur Utama PT Taspen,NonClickbait
"Tanggapi Soal Perdebatan Revisi UU Pemilu dan Pilkada, Mensesneg: Jangan Dikit-dikit UU Diubah",NonClickbait
"Oknum Guru Lecehkan Anak Lelaki Sebanyak 19 Kali, Lakukan Aksi Bejat dari Tahun 2018 hingga 2020",NonClickbait
Presiden Jokowi Keliling Pasar Tanah Abang Tinjau Vaksinasi Massal Covid-19,NonClickbait
"Viral Video Bocah Ketiduran di Pelaminan, Malu-malu saat Direkam, Pengunggah: Mungkin Dia Kelelahan",Clickbait
"Detik-detik Begal Tewas Dihajar Massa, Modus Pura-pura Bantu Korban Dorong Motor",Clickbait
"Truk Pengangkut BBM Masuk Jurang di Cianjur Jabar, Ini yang Dikhawatirkan Warga",Clickbait
"Mobil Kijang Masuk Lubang Tengah Jalan di Wonosobo, Berikut Kronologinya",Clickbait
Komisi IX DPR Siap Jadi Relawan Uji Klinis Fase 2 Vaksin Nusantara,NonClickbait
Pemkot Semarang Rencanakan Vaksinasi Tahap 2 Mulai 21 Februari 2021,NonClickbait
"Wanita yang Tengah Hamil 8 Bulan di Gowa Sulsel Terkena Peluru Nyasar, Begini Kejadiannya",Clickbait
"Polisi Gadungan Peras Remaja, Pelaku Cari Mangsa di FB, Korban Ditakuti Namanya Masuk DPO",NonClickbait
Ajun Perwira Dipulangkan setelah Bersaksi Kasus Narkoba Jennifer Jill,NonClickbait
Kisah Kapolsek Astanaanyar Kompol Yuni yang Diamankan Gegara Narkoba,NonClickbait
Penampakan Jennifer Jill Usai Ditangkap Terkait Kasus Narkotika,NonClickbait
Potret Desa di Tuban yang Ratusan Warganya Jadi Miliarder Lalu Borong Mobil,Clickbait
Ajun Perwira Sebut Hasil Tes Urine Jennifer Jill Negatif Narkoba,NonClickbait
Pertamina Jawab Heboh Warga Tuban Borong Mobil Gara-gara Proyek Kilang,Clickbait
Cerita Miliarder Desa Belum Berani Nyetir ke Kota Tuban Usai Borong 2 Mobil,NonClickbait
Sudah Berapa Lama Jennifer Jill Konsumsi Narkotika?,Clickbait
AHY Bicara Lagi soal Kudeta PD: Presiden Tak Tahu Keterlibatan Bawahannya,NonClickbait
"Bale Minim Dimainkan Mourinho, Begini Jawaban Agennya",Clickbait
"Vaksin Nusantara dr Terawan Pakai Sel Dendritik, Diklaim Pertama di Dunia",NonClickbait
Deretan Foto Bukti Manusia Adalah Makhluk yang Ceroboh (2),NonClickbait
"Pria Ini Bunuh Ular Piton 136 Kg, Alasannya Demi Hentikan Wabah",Clickbait
Ini Alasan Alesya Kafelnikova Berpose Telanjang di Punggung Gajah di Bali,Clickbait
Menko PMK Muhadjir Sebut Borobudur Bukan Pusat Ibadah Umat Buddha Dunia,NonClickbait
Keindahan Alam Kalimantan Barat dalam Foto,NonClickbait
Vaksin Nusantara Karya RI Pakai Sel Dendritik Ini Cara Kerjanya,Clickbait
Keren! Begini Tampilan Makanan Indonesia Dalam Gambar Animasi,Clickbait
"Viral Penjual Siomay Pakai Motor Ducati Diavel, Ini Faktanya!",Clickbait
"Salah Satunya karena Komorbid, 972 Nakes di Yogya Belum Divaksin COVID-19",NonClickbait
Ririe Fairus Saat Beri Kue Ultah untuk Ayus Sabyan hingga Santai di Kafe,NonClickbait
UPDATE 17 Februari: Kematian Pasien Covid-19 Jakarta Tembus 5.026,NonClickbait
"PPKM Mikro di Kota Malang, Setiap RT Dapat Insentif Rp 500.000",NonClickbait
Menkes: Rasio Kasus Positif Covid-19 di Indonesia Tidak Normal,NonClickbait
"Banjir Landa 4 Kecamatan di Sidoarjo, BPBD Sebut Akibat Luapan Sungai",NonClickbait
"Pengantin Ditagih Bayar Arisan, Ini Kronologi Resepsi Pernikahan yang Geger di Kota Solo",Clickbait
"Jadi Tersangka Kasus Dugaan Korupsi Retribusi Pasar, 2 ASN Pemkot Probolinggo Ditahan",NonClickbait
"Vaksin Nusantara Berbasis Sel Dendritik, Kelebihannya Aman dan Bersifat Personal",NonClickbait
Ini Jumlah Cabang Olahraga Prioritas Vaksin Corona,Clickbait
Keren! Spiderman hingga Doctor Strange Pantau Vaksinasi Anak di Kendal,Clickbait
Berapa Harga Rumah Subsidi di 2021?,Clickbait
"Jaringan Telekomunikasi di Intan Jaya Terganggu 2 Hari Terakhir, Ini Alasannya...",Clickbait
"Sertijab, Bupati Kendal Mirna Annisa Tidak Hadir",NonClickbait
"Mau Nonton Final Putra Australia Open 2021, Ini Banderol Tiketnya",Clickbait
Rumah Sakit Ini Jadi Tempat Vaksinasi Covid-19 untuk Atlet di Jakarta,Clickbait
Undang-Undang untuk Lindungi dan Hentikan Kriminalisasi pada Korban,NonClickbait
"Gubernur DIY Sultan HB X Siap Dialog dengan ARDY, Dimediasi Ombudsman RI",NonClickbait
Keren! Mahasiswa ITB Bikin Pesawat Nirawak Dilengkapi Beragam Teknologi,Clickbait
"Usai Perkosa Anaknya hingga Hamil, Pria Ini Paksa Korban Berhubungan dengan ODGJ untuk Hilangkan Jejak",Clickbait
"Kualifikasi Piala Dunia 2022, Ini Permintaan Iran",Clickbait
"Everton Vs Man City, Ancelotti Bisa Ulangi Rekor Buruk Saat Masih di AC Milan",NonClickbait
Abraham Samad Nilai Wacana Hukuman Mati untuk Edhy Prabowo dan Juliari Batubara Bisa Beri Efek Jera,NonClickbait
"Periksa Staf Khusus, KPK Dalami Penggunaan Uang untuk Edhy Prabowo dan Istri",NonClickbait
"Basis Data Diduga Diretas, Kejaksaan Sebut Aplikasi dan Sistem Normal",NonClickbait
AHY Sebut Jokowi Tak Tahu Ada Bawahannya Mau Mengkudeta Demokrat,NonClickbait
"Menko PMK Bakal Evaluasi Cuti Bersama 2021, Jumlah Libur akan Dikurangi",NonClickbait
"Aturan Siswi Tak Wajib Pakai Jilbab, Tokoh Minang Tersinggung & Tolak SKB 3 Menteri",NonClickbait
PDIP: SBY Menzalimi Diri Sendiri Demi Politik Pencitraan,NonClickbait
Menko PMK Soroti Penanganan Limbah Medis yang Meningkat Selama Pandemi Covid-19,NonClickbait
Zainudin Amali Terima Kunjungan Imam Besar Masjid Istiqlal: Bahas Kerjasama Sektor Kepemudaan,NonClickbait
Menko PMK Minta Pemda Nganjuk Segera Tetapkan Tahap Rehabilitasi Rekonstruksi,NonClickbait
Peneliti LIPI: ASEAN Bisa Mainkan Peran Strategis Berdialog dengan Junta Militer Myanmar,NonClickbait
Antam Disebut Perlu Libatkan Putra Daerah untuk Dorong Pemerataan Ekonomi,NonClickbait
Ken Setiawan Tak Heran Ada Artis Berbaiat Terhadap Kelompok Radikal: Sejak Tahun 2000 Sudah Banyak,NonClickbait
"Pertanyaan Soal Cara Kritik Tanpa Dipolisikan Dianggap Provokasi, JK: Saya Bertanya dengan Tulus",NonClickbait
Dorong Perlindungan Awak Kapal Ikan dengan Kepastian Upah Minimum dalam Kacamata UU Cipta Kerja,NonClickbait
"Viral Video CCTV Pocong Dikejar Anjing, Ini Kata Roy Suryo",Clickbait
China tangkap bos pemalsu vaksin Covid-19 beromzet miliaran rupiah,NonClickbait
"Tekan Fatalitas, Jasa Raharja dan Korlantas Polri Sinergi Latih Komunitas Tangani Korban Laka Lantas",NonClickbait
"Profil Dirjen Dukcapil Zudan Arif Fakrulloh, Sosoknya Viral saat Jawab Foto e-KTP Bisa Diganti",Clickbait
Muchdi PR Ajukan Banding Usai PTUN Kabulkan Gugatan Tommy Soeharto,NonClickbait
"Ayah Cabuli Anak Tiri Berulang Kali, Janji Belikan Laptop & HP, Pelaku Kini Divonis 8 Tahun Penjara",NonClickbait
"Guru Honorer yang Dipecat karena Unggah Jumlah Gaji akan Kembali Mengajar, Kepala Sekolah Minta Maaf",NonClickbait
"Remaja Ini Nekat Jadi Mucikari Gara-gara Dipecat dari Kerjaan, Jajakan Remaja 14 Tahun di Facebook",Clickbait
"Polisi Salah Gunakan Narkoba, Dipecat Saja Tidak Cukup, Ahli Psikologi Forensik: Polri Perlu Audit",NonClickbait
"Ayah Tega Cabuli Anak Kandung Selama 4 Tahun, Berawal di Ruang TV, Pelaku Ngaku Khilaf dan Nafsu",NonClickbait
"Seorang Anak di Bawah Umur Dirudapaksa 5 Remaja di Lapangan, Korban Datang karena Hendak Diberi Uang",NonClickbait
Sekjen PDIP: Sejarah Membuktikan Pak SBY Menzolimi Dirinya Sendiri Demi Politik Pencitraan,NonClickbait
"Ngaku Dapat Bisikan Gaib, Pria 51 Tahun Bakar Rumah dan Ibu Kandung yang Sedang Tidur",NonClickbait
"Mantan Pak Kades Dilapor Eks Istri Sirinya di Banyuasin, 'Kembalikan Motor Saya'",NonClickbait
"Seorang Pria Curi Mesin Air, Barang Curian Dititipkan untuk Bayar Utang, Malah Ketahuan Pemilik",NonClickbait
Ini Perbandingan Utang Luar Negeri Era SBY dengan Era Jokowi,Clickbait
JK Tanggapi Jawaban Istana soal Cara Kritik Pemerintah dengan UU ITE: Kasih Rambu yang Lebih Ringkas,NonClickbait
"Profil Kompol Yuni Purwanti, Kapolsek Astana Anyar yang Terjerat Narkoba, Punya Utang Rp 340 Juta",NonClickbait
"Biasa Tangani Kasus, Rekan Kerja Fredrich : Fee dari Setnov Merupakan yang Paling Murah",NonClickbait
"Kepergok Mengais Sisa Makanan di Tong Sampah, Seorang ART Ngaku Kelaparan, Tak Digaji Bertahun-tahun",NonClickbait
"Kisah Pariyem ART Makan Sisa Sampah: Gaji Tak Dibayar Bertahun-tahun, Ternyata Kerap Dipukul Majikan",NonClickbait
"Kakek 71 Tahun Meninggal Dunia Posisi Sujud, Wajahnya Sudah Membengkak, Ada Obat di Sebelahnya",NonClickbait
Google Salurkan 75 Juta Dolar Bantuan Usaha Kecil Yang Terpukul Pandemi,NonClickbait
"Soal Kasus Selebgram Helena Lim, Ombudsman Duga Ada Pemalsuan Surat Keterangan dari Pemilik Faskes",NonClickbait
"Dipecat dari Kerjaan, Remaja Ini jadi Muncikari, Tawarkan Gadis 14 Tahun Rp 650 Ribu Sekali Kencan",Clickbait
Petaka Tembakan di Kepala Tewaskan Demonstran Antikudeta,NonClickbait
Heboh Ustaz Sofyan Chalid Sebut Wisata ke Borobudur Haram,Clickbait
"Annisa Pohan Diserang di Twitter, Andi Arief: Hentikan Kak Mul",NonClickbait
"Sekilas Kyril Louis-Dreyfus, Pemilik Klub Liga Inggris Paling Muda Saat Ini",NonClickbait
"Pelarian Pembunuh Terapis di Mojokerto, Gadaikan Motor Hingga Dihantui Korban",NonClickbait
"Vicky Prasetyo dan Kalina Oktarani Batal Nikah, Ingat Lagi Ucapan Benzema",NonClickbait
Telegram Kapolri: Aparat Ungkap Kasus Narkoba di Kepolisian Dapat Reward,NonClickbait
"Fredy Kusnadi Ditangkap, Dino Patti Djalal: Ini Momen Lawan Mafia Tanah",Clickbait
"Wacana Revisi UU ITE Mengemuka, Mahfud Md Bentuk 2 Tim Khusus",NonClickbait
"Beredar, Inikah Dewas-Direksi Baru BPJS Ketenagakerjaan & Kesehatan?",Clickbait
8 Potret Mantan Model yang Dipecat dari Rumah Sakit karena Terlalu Cantik,Clickbait
"Ayus Sabyan dan 5 Artis Pria yang Dituding Selingkuh, Kepincut WIL",Clickbait
Kemenkes Jelaskan Dua Alur Pendaftaran Vaksin COVID-19 Lansia di RI,NonClickbait
Terungkap! Ini Penyebab Mertua Tendang Pengantin Saat Akad Nikah di NTB,Clickbait
Momen 'Crazy Rich Malang' Gilang Widya Pranama Saat Cicip Makanan Mewah,NonClickbait
"Sudah Bisa Daftar, Lansia Akan Mulai Divaksin COVID-19 Minggu Depan",NonClickbait
"Bye-bye Contra Flow, Jalur Darurat Tol Cipali Bisa Digunakan Malam Ini",NonClickbait
Upaya Thailand Hapus Citra Wisata Seks dengan SEXY,NonClickbait
Catat! Ini Daftar Pelanggaran yang Diincar dalam Operasi Patuh Jaya 2021,Clickbait
Heboh! Kandang Godzilla di Tangerang Dijadikan Tempat Foto Bugil,Clickbait
Hotel Kelas Atas Korsel Minta Maaf Karena Ruang Sauna Bisa Diintip,NonClickbait
"Bukan PPnBM 0%, Tesla Termurah Turun Harga",NonClickbait
Sah! Inter Milan Juara Liga Italia 2020/21,Clickbait
"Inter Juara Liga Italia, Juventus: Selamat dan Tunggu Musim Depan!",NonClickbait
"Jelang MU Vs Liverpool, Suporter Invasi Lapangan Old Trafford!",NonClickbait
"Viral Jemaah Masjid di Bekasi Dilarang Pakai Masker, Berakhir Damai",Clickbait
Wali Kota Makassar Ngamuk di Mal Lihat Kerumunan Tanpa Prokes!,NonClickbait
Ratusan Kendaraan Terpaksa Putar Balik Akibat Penyekatan di Karawang Kota,NonClickbait
Jerit India Kewalahan Hadapi Lonjakan Corona,NonClickbait
MotoGP Spanyol: Ada Apa dengan Fabio Quartararo?,Clickbait
"Hasil MotoGP Spanyol 2021: Jack Miller Juara, Ducati Finis 1-2",NonClickbait
Cerita Pemudik Motor Lintasi Jalur Pantura Subang di Minggu Malam,NonClickbait
6 Balasan Chat Pas Mau Curhat ke Teman Ini Bikin Kesal Tapi Lucu,Clickbait
"4 Variasi Bercinta Biar Istri Raih 'Nipplegasm', Tertarik Coba?",Clickbait
"Hasil MotoGP Spanyol 2021: Jack Miller Juara, Quartararo Tercecer",NonClickbait
Potret Romantis Angbeen Rishi dan Adly Fairuz SaatMakan Bareng,Clickbait
"Tsunami COVID, Ini Daftar Negara yang Masukkan Traveler India ke Daftar Merah",Clickbait
Ingat Zona Merah Bertambah Lebih dari Tiga Kali Lipat,NonClickbait
Tes Kepribadian: Gambar Pahlawan Super atau Pria yang Pertama Kamu Lihat?,Clickbait
"Jadi Cameo Vincenzo, Netizen Histeris Lihat Kakak Chanyeol EXO yang Cantik",Clickbait
"Daihatsu Rocky Tertinggi Tembus Rp 236 Juta, Dapat Fitur Safety Seperti Mobil Mewah",NonClickbait
"Man United Vs Liverpool Ditunda, Ini Pernyataan Klub soal Unjuk Rasa Suporter",Clickbait
Laga Man United Vs Liverpool Resmi Ditunda,NonClickbait
Jadwal Imsak dan Buka Puasa di Tangerang Raya 3 Mei 2021,NonClickbait
4 Kreasi Menu Buka Puasa Berbahan Umbi-Umbian,Clickbait
"Pasca Kerumuman di Tanah Abang, Presiden Ingatkan Agar Tak Sepelekan Covid-19",NonClickbait
Perundingan Nuklir Iran di Wina Capai Kemajuan,NonClickbait
Ribuan Warga Myanmar Siap Mengungsi ke Thailand,NonClickbait
Kerja Berat Penggali Makam Covid-19 India: Shift 24 Jam dan Tak Bisa Puasa,NonClickbait
Perjalanan Inter Milan Meraih Gelar Juara Liga Italia 2020-2021,NonClickbait
"Viral, Video Arogansi ""Debt Collector"", Si Ibu Pemilik Masih di Atas Motor, Main Diangkat 3 Pria",Clickbait
Intip Cara Menata Ruang Belajar ala Drama Korea,NonClickbait
Video Penangkapan Munarman Dinilai Menampilkan Kesan Polisi Arogan,NonClickbait
"Old Trafford Diserbu Pengunjuk Rasa, Kickoff Man United Vs Liverpool Ditunda",NonClickbait
Pelabelan Teroris Perlemah Proses Dialog Jakarta-Papua,NonClickbait
"Hadirkan Posko THR, Kemnaker Terima 776 Laporan terkait THR 2021",NonClickbait
"Jejak Tangan Anak-anak, Diduga Ritual Misterius Peradaban Maya Ditemukan di Gua Meksiko",NonClickbait
"KRL Tak Berhenti di Stasiun Tanah Abang Pukul 15.00 sampai 19.00 WIB, Ini Rekayasa Jalurnya",Clickbait
"Antonio Conte, Memulai dan Mengakhiri Rentetan 9 Scudetti Juventus",NonClickbait
Ketua Komisi X Nilai Penggabungan Kemendikbud Risti Jadi Tantangan Penyelenggaraan Pendidikan,NonClickbait
"Ingin Cagur Reuni, Bedu: Narji dan Denny Bisa",NonClickbait
"Heboh Penggusuran Rumah Rocky Gerung, Begini Penjelasan Sentul City",Clickbait
Ratusan Santri di Boyolali Memperingati Nuzulul Quran,NonClickbait
"Beredar Video Gerbang Tol Pejagan Ditutup, Ini Kata Polisi",Clickbait
"Besok Sore KRL Tak Berhenti di Tanah Abang, Warga Bisa ke Stasiun Duri dan Karet",NonClickbait
"Sambangi Warga, Gibran Kembalikan Uang Hasil Pungli Lurah",NonClickbait
"Ibu Hamil di Pandeglang Ditandu 4 Km ke Puskesmas, Sempat Jatuh dan Bayi Meninggal",NonClickbait
"Begini Jadinya Razia Polisi Dirazia oleh Sesama Polisi, Perwira Ikut Turun Tangan",Clickbait
"Sopir Ojol Ini Pertama Kali Makan Steak Diajak Orang Baik, Santap Lahap Bikin Haru",Clickbait
Potret Sigi Wimala Keren Abis Sampai Disebut Galgadot Versi Indonesia,Clickbait
Bukalapak Tunjuk Bambang Brodjonegoro dan Yenny Wahid Jadi Komisaris,NonClickbait
8 Cara Ampuh Jaga Kesehatan Pencernaan pada Bulan Ramadan,Clickbait
Puasa yang Tepat Bisa Turunkan Kadar Lemak Jahat dalam Tubuh,NonClickbait
"All New Toyota Raize Bawa TSS, Ini Fitur-fitur Keamanan Cerdas nan Kerennya!",Clickbait
6 Hal yang Pantang Kamu Lakukan Sebelum Berlari atau Berolahraga Lainnya,Clickbait
Alasan Fikayo Tomori Tinggalkan Chelsea dan Gabung AC Milan,NonClickbait
"10 Gaya Artis Indonesia Tirukan Drama Korea, Chika Jessica Bikin Ngakak",Clickbait
"MU Ikutan City dan Madrid Buru Pemain Rp 1,9 Triliun Ini",Clickbait
"Besok Sore KRL Tak Berhenti di Tanah Abang, Warga Bisa ke Stasiun Duri dan Karet",NonClickbait
"Sambangi Warga, Gibran Kembalikan Uang Hasil Pungli Lurah",NonClickbait
"Ibu Hamil di Pandeglang Ditandu 4 Km ke Puskesmas, Sempat Jatuh dan Bayi Meninggal",NonClickbait
Bukalapak Tunjuk Bambang Brodjonegoro dan Yenny Wahid Jadi Komisaris,NonClickbait
Puasa yang Tepat Bisa Turunkan Kadar Lemak Jahat dalam Tubuh,NonClickbait
"Seorang Pemuda di Cianjur Bakar Kekasihnya Sendiri, Tubuh Disiram Pertalite, Kondisi Korban Kritis",NonClickbait
"Unjuk Rasa Hardiknas di Makassar Dibubarkan, Leher Mahasiswa UINAM Dipiting Polisi",NonClickbait
"Sidak ke Mal Panakukang, Wali Kota Makassar Bubarkan Pengunjung yang Membludak",NonClickbait
Jokowi: Jangan Merasa Situasi Pandemi Covid-19 Sudah Aman,NonClickbait
MKD DPR Didesak Segera Proses Azis Syamsuddin,NonClickbait
Elemen Kepemudaan di Kemang Bogor Turun Ke Jalan Bagikan Takjil untuk Masyarakat,NonClickbait
"Cegah Penumpukan Penumpang Terulang, Stasiun Tanah Abang Kurangi Jam Operasional Mulai Senin Besok",NonClickbait
"Pecah Rekor, India Jadi Negara Pertama yang Catat 400 Ribu Kasus Covid-19 dalam Sehari",NonClickbait
"Di Masa Pandemi Covid-19, Tiga Restoran Cepat Saji di Mal Graha Cijantung Dipadati Pembeli",NonClickbait
"Viral Kasus Remaja Pria Diduga Dirudapaksa Biduan Dangdut, Begini Tanggapan Pakar Hukum",Clickbait
Tari Saman Gebrak Unesco International Dance Day di Wellington Selandia Baru,NonClickbait
Saat Erick Thohir Rayu Sopir Pikap Dukung Persis Solo,NonClickbait
Hasto dan Eddy Dorong Pemuda Muhammadiyah Didik Para Pemuda Negarawan,NonClickbait
"23 Saksi Kasus Alat Tes Antigen Bekas Diperiksa, Berikut Sosok Dalang di Balik Kejahatan Tersebut",Clickbait
"Berawal dari Pelanggaran Lalu Lintas, Polres Singkawang Justru Temukan 37 Paket Sabu saat Buka Jok",NonClickbait
"Presiden: Jangan Lengah dan Berpuas Diri, Tetap Disiplin Jalankan Protokol Kesehatan",NonClickbait
"Wajah Baru, Zainal Abidin Ingin Kepengurusan Peradi Solo Lebih Transparan & Terbuka",NonClickbait
"Siniar Perdana dengan Menteri Nadiem, Presiden RI Sampaikan Pesan Hardiknas",NonClickbait
Misteri sate beracun yang memakan satu bocah do Bantul Yogyakarta akhirnya terungkap.,NonClickbait
"Kyrgystan-Tajikistan Bentrok di Perbatasan, Rusia Tengahi Potensi Konflik Susulan",NonClickbait
Heboh Oknum Dokter di Semarang Campurkan Sperma ke Makanan Istri Temannya,Clickbait
"Mulai Besok, Pukul 15.00-19.00 WIB, KRL Tak Akan Berhenti di Stasiun Tanah Abang",NonClickbait
"Pengunjung Pasar Tanah Abang Capai 100 Ribu Orang, Anies Ungkap Stategi Kendalikan Kerumunan",NonClickbait
Aksi Sosial Persaudaraan Setia Hati Terate Cabang Bogor Bagikan Takjil,NonClickbait
"Kemnaker Terima 776 Laporan Terkait THR 2021, Yang Mengadu Ada 292",NonClickbait
Update: Jumlah Penerima Vaksin Hari Ini Hanya 24.803,NonClickbait
Gus Miftah: Mengapa Bulan Puasa Maksiat Masih Ada?,Clickbait
"Macet 4 Km, Polisi Setop Sementara Penyekatan di Tol Cikarang Utama",NonClickbait
Protes Pasien Jadi Awal Terbongkarnya Bisnis Alat Rapid Test Ilegal,NonClickbait
Update Terkini Kasus Takjil Sianida: Nani dan Tomy Bantah Nikah Siri!,NonClickbait
Chelsea Vs Real Madrid: Lantai Dansa Kai Havertz,NonClickbait
"Spurs Ikhlas Harry Kane ke PSG, Tidak ke MU",NonClickbait
85 WN China Tiba di Indonesia Pakai Pesawat Carter,NonClickbait
"Antisipasi Pekerja Tertahan, Polisi Bakal Buka Tol Cikarang Pagi dan Sore",NonClickbait
"Umi Pipik Cerita Dipoligami, Keluarga Baru Tahu Setelah Uje Meninggal",NonClickbait
Jabar Sumbang 1.038! Ini Sebaran 5.647 Kasus Baru COVID-19 RI 6 Mei,NonClickbait
"Berani-beraninya Bus Akap Ini Kelabui Petugas: Ngaku Kosong, Ternyata Bawa Penumpang Mudik",Clickbait
"Bakal Dipakai untuk Vaksinasi Gotong Royong, Berapa Harga Vaksin Sinopharm?",Clickbait
Ini Potret Wanita yang Dulu Istri Pejabat Kini Jadi Ojek Online di Cirebon,Clickbait
