Judul,Keterangan
Sosok Eks Kasat Reskrim Polres Wonogiri: Suka Bercanda-Sigap Bekerja,Clickbait
Wagub DKI Ungkap Isi Pertemuan Anies dengan Prabowo,NonClickbait
"Lazio Kalah dari AC Milan, Maurizio Sarri Beberkan Penyebab Diusir Wasit",NonClickbait
Tanda Tanya Kasus Corona Turun Drastis di India,NonClickbait
"Unik, Tiap Rumah Warga di Kampung Ini Punya Kolam Ikan Patin",Clickbait
Liverpool Vs Manchester City Bagai Laga Final buat The Reds,NonClickbait
Ini Alasan AHY Tampil Langsung Ungkap Isu Kudeta Demokrat,Clickbait
"Tips Aman Makan di Restoran Saat Covid-19, Saran dari Dokter",NonClickbait
"Kisah Hidup Susi Pudjiastuti, Putus Sekolah jadi Pengepul Ikan di Pangandaran",NonClickbait
"Tak Perlu Renovasi, Ini 7 Cara Bikin Rumah Lebih Nyaman",Clickbait
Ngakak! Cara Istri Siapkan Makanan Suami Saat Awal hingga 50 Tahun Pernikahan,Clickbait
Aktris Cantik Ini Ternyata Pernah Jadi Pacar Rahasia Tom Cruise,Clickbait
Ini Dampak yang Akan Terjadi jika Anak Menjadi Korban Cyber Bullying,Clickbait
Manajer Repsol Honda Tak Tahu Kapan Marc Marquez Bisa Balapan Lagi,NonClickbait
"Gong Yoo Sebut Dirinya Bukan Tipe Pria Ideal, Kenapa?",Clickbait
Cara Melindungi Data Pribadi Kita pada Jejaring Sosial dan Aplikasi Android,NonClickbait
Potret Dokter Terseksi yang Dibilang Munafik karena Party Saat Pandemi,Clickbait
Panglima LPI Ungkap Alasan Tolak Dandim Jakpus Masuk Gang Rumah Habib Rizieq,NonClickbait
"Habib Rizieq Tak Ingin Hasil Tes Swab Dipublikasikan, Ini Alasannya",Clickbait
"4 Cerita Unik Penghulu, Nikahkan Mantan Istri dengan Sahabatnya",Clickbait
Heboh Beredar Video Pernikahan Ayah Taqy Malik dan Marlina,Clickbait
"Merinding, Cerita 3 Pria Menunggu Pasien di RSK Tayu Pati yang Ternyata Mangkrak sejak 2013",Clickbait
"Tak Mau Disalip Klub Lain, Man City Siap Tebus Haaland Rp 1,9 T",NonClickbait
PD Protes Alasan Istana Enggan Jawab Surat AHY,NonClickbait
Thomas Tuchel Suka Cara Chelsea Bertahan,NonClickbait
"Ibu di Ngawi Mesum Bareng Pacar Sang Putri, Pelaku Pria Ditangkap",NonClickbait
5 Ciri Laki-laki yang Nggak Jago Puaskan Pasangan,Clickbait
Ini 5 Negara yang Tidak Pernah Dijajah Bangsa Asing,Clickbait
"Makin Canggih, Ini Penampakan Suzuki Hayabusa 2021",Clickbait
4 Cara Cek Pajak Kendaraan DKI Jakarta via Samsat Online,Clickbait
Cerita Rakyat Nusantara Populer dari Sangkuriang hingga Timun Mas,NonClickbait
"Musim Hujan, 5 Posisi Seks Ini Paling Nyaman Dilakukan di Balik Selimut",Clickbait
"8 Gaya Ikke Nurjanah Nikah Lagi Setelah 14 Tahun Menjanda, Cantik Bersahaja",Clickbait
Foto: 5 Referensi Wisata Depok Saat Pandemi Mereda,Clickbait
Lebih dari 1.000 Restoran Tumbang akibat COVID-19,NonClickbait
Hasil Undian dan Jadwal Semifinal Copa del Rey - Barcelona Vs Sevilla,NonClickbait
"Link Live Streaming Fiorentina Vs Inter Milan, Nerazzurri Superior di Hadapan Lawan",NonClickbait
Mengenang Jockie Suryoprayogo: Musiknya Berjiwa dan Bercerita,NonClickbait
Eks Pengurus FPI Sulsel Bantah Munarman Hadiri Acara Baiat kepada Teroris ISIS di Makassar,NonClickbait
Demokrat: Keterlibatan Pejabat Negara Ancam Kedaulatan Parpol dan Demokrasi,NonClickbait
Dedi Mulyadi Minta Buwas Sebutkan Nama Setan di Lingkaran Kedelai,NonClickbait
"Kecelakaan Kerja, Seorang Pegawai Meninggal Tersengat Listrik",NonClickbait
"Seputar KRL Jogja-Solo: Jadwal, Harga Tiket, dan Stasiun Pemberhentian",NonClickbait
"Kembali Naik Meja Operasi, Comeback Ansu Fati Tertunda",NonClickbait
"Bupati Wonogiri Tempatkan Satgas Covid-19 di Pasar Saat ""Jateng di Rumah Saja""",NonClickbait
"Pensiun dari UFC, Khabib Diklaim Belum Menguasai Satu Teknik Penting",NonClickbait
Eks Pengurus FPI Sulsel Bantah Pernah Adakan Baiat kepada Teroris ISIS di Makassar,NonClickbait
"Oknum Guru Ini Cabuli Murid Berkali-kali, Korban Diberi Obat Anti Hamil",Clickbait
"Pengunggah Video ""Kasat Narkoba Polres Pematangsiantar Lagi Tinggi"" Dijerat UU ITE",NonClickbait
"Dua Harimau Sinka Zoo Singkawang Lepas, Seorang Pawang Tewas",NonClickbait
"Puskapol UI Nilai UU Pemilu Perlu Dibahas, Banyak Persoalan Harus Diselesaikan",NonClickbait
Sopir Mobil yang Kabur Usai Tertabrak Motor di Karang Tengah Menyerahkan Diri ke Polisi,NonClickbait
"Pertama Kali dalam Sejarah, Gunung Merapi Kini Miliki 2 Kubah Lava",NonClickbait
Unik! Pria dan Wanita di Desa Ini Bicara Pakai Bahasa Berbeda,Clickbait
Kemendagri Harap 17 Februari Semua Kepala Daerah Pemenang Pilkada Serentak 2020 Sudah Dilantik,NonClickbait
Kenapa Kucing Suka Mendengkur?,Clickbait
Demokrat Ungkap Manuver Moeldoko di Balik Isu Kudeta Partai,NonClickbait
"Fakta-Fakta Sertifikat Tanah Elektronik Wajib Tahu, Termasuk Nasib Sertifikat Kertas",NonClickbait
"Menurut Penelitian NASA, Ini 9 Tanaman Hias Pemurni Udara Terbaik",Clickbait
"Sederet Fakta Ayu Ting Ting Batal Nikah, Ini Foto Mesranya dengan Adit Jayusman",Clickbait
"Anak Berdiam Lebih Lama di Rumah, Berikut Cara Bantu Jaga Kesehatan",NonClickbait
WO Ayu Ting Ting dan Adit Jayusman Bongkar Pihak yang Batalkan Pernikahan,NonClickbait
6 Cara Cepat dan Mudah untuk Menghilangkan Demam dari Tubuhmu,Clickbait
"Cerita Tragis Rumah Raffi Ahmad Pernah Kemalingan, Sopir Dibacok Pelaku",NonClickbait
"Ungkap Korupsi Jiwasraya dan Asabri, Jaksa Agung Ngaku Diapresiasi Publik",NonClickbait
" Surya Paloh Instruksikan NasDem Hentikan Pembahasan Revisi UU Pemilu, Dukung Pilkada Serentak 2024",NonClickbait
Rizal Maulana Sebut 2 Fenomena Menarik di Balik Tudingan Kudeta AHY,NonClickbait
" Sedang Kendarai Sepeda Motor, Remaja 15 Tahun Tiba-tiba Dipanah Orang Misterius",NonClickbait
" Cerita Belasan Kambing di Bondowoso Alami Luka Misterius, Diserang Malam Saat Warga Tertidur",NonClickbait
"Fakta Baru Pembunuhan Sadis Dalang Ki Anom Subekti dan Keluarga, Ada Sidik Jari Diduga Milik Pelaku",NonClickbait
" Seorang Karyawati Alami Pendarahan Ngakunya Menstruasi, Ternyata Habis Melahirkan di Toilet Pabrik",NonClickbait
9 Fakta Karier Nissa Sabyan: dari SMK Ototronik hingga Honor Fantastis,Clickbait
Apa Alasan Jennifer Jill Simpan Sabu Sejak 4 Tahun Lalu?,Clickbait
Bosan ke Bandung? Coba Berakhir Pekan ke 5 Destinasi Ini,Clickbait
Pakaian Kaku Setelah Dijemur? Coba Cara Ini,Clickbait
" Fakta 7 Tersangka Terorisme yang Dibawa ke Jakarta, Rencanakan Serang Mako Polri hingga Rampok Toko",Clickbait
Polisi Ungkap Kasus Pembunuhan di Bekasi: Bermotif Dendam dan Asmara,NonClickbait
"Registrasi Akun LTMPT Dibuka Kembali 7 Februari 2021, Akses portal.ltmpt.ac.id, Ini Caranya",Clickbait
Reaksi PKB dan NasDem Disebut-sebut Dukung Moeldoko untuk Pilpres 2024 di Tengah Isu Kudeta Demokrat,NonClickbait
Cerita Korban Penculikan yang Dikenai Denda Rp 50 Juta karena Dianggap Langgar Karantina Covid-19,NonClickbait
" Anies Baswedan Dapat Penghargaan Dari TUMI, Ketua GPMI Jakarta: Ini Prestasi Gemilang Tingkat Dunia",NonClickbait
Sekjen Demokrat: Moeldoko Tak Hanya Mendukung tapi Terlibat Aktif Ingin Ambil Kepemimpinan Partai,NonClickbait
"VIRAL Seorang Gadis Masak Telur dan Mi Instan Bertabur Emas 24 Karat, Begini Penuturannya",Clickbait
6 Cara Mencegah Kolesterol Melonjak Drastis pada saat Lebaran,Clickbait
Banjir di Kota Pekalongan Berwarna Merah!,Clickbait
"Bikin Merinding Fans MU, Ronaldo Ternyata Kembali ke Pangkuan Manchester United, Bukan City",Clickbait
"7 Fakta Pembunuhan Kakak Beradik di Sidoarjo, Nomor 3 Bikin Merinding",Clickbait
"Stasiun Tawang Semarang Kebanjiran, Jadwal Perjalanan KA Terganggu",NonClickbait
Rumah Mungil di Kawasan Padat Kebon Jeruk Masuk Nominasi Penghargaan Dunia,NonClickbait
"2 Harimau Sinka Zoo yang Lepas Ternyata Ditinggal Pawang, Dititipkan ke Teman",Clickbait
"Wanita Ini Dapat Tanaman Duda Bolong setelah Kehilangan Janda Bolong, Ini Kisah Lengkapnya",Clickbait
"Heboh Monstera Variegata Rp 225 Juta, Ini Alasan Harganya Mahal",Clickbait
"Warga Cerita Kecelakaan Maut di Tanah Abang: Sopir Kabur, Penumpang Ngopi",NonClickbait
Awas! Harimau di Singkawang Masih Lepas Setelah Tewaskan Pawang,Clickbait
"Jangan Nekat, Ini Batas Aman Naik Motor Saat Banjir",Clickbait
5 Fakta Unik Ronaldo Usai Cetak 2 Gol di Man Utd vs Newcastle,Clickbait
"Geger, Banjir di Pekalongan Berwarna Merah, Ternyata dari Pewarna Batik yang Sengaja Dibuang",Clickbait
"Kasat Narkoba Dinonaktifkan, Pengunggah Dijerat UU ITE, Ini Fakta Video Viral ""Kasat Narkoba Lagi Tinggi""",Clickbait
Alokasi Fasilitas Likuiditas Pembiayaan Perumahan 2021 Naik 70 Persen,NonClickbait
"Jaksa Agung: Siapa Pun yang ""Backup"" Benny Tjokro, Kita Sikat",NonClickbait
Cara Melindungi Koleksi Buku di Rumah Agar Terhindar Dari Jamur,NonClickbait
"Cerita Bagus Kahfi Saat Tembus Garuda Select, Kalahkan Ratusan Nama Usai Gagal ke Piala Dunia",NonClickbait
Marsha Aruan Bermasalah dengan Absen Kuliah gara-gara Pekerjaan di Luar Negeri,NonClickbait
"Anies Bertemu Prabowo, Riza Patria Sebut Tak Bahas Pilkada DKI",NonClickbait
"5 FAKTA Bupati Cup Pandeglang Berhadiah Rp 95 Ribu: Anggaran Capai Rp 150 Juta, Kadispora Dicopot",Clickbait
"5 Potret Rumah Crazy Rich Surabaya Amelia Salim, Bantal Hermesnya Senilai Rp200 Juta",Clickbait
"Pernikahan Crazy Rich Bandung Doni Salmanan Mewah Banget, Ini Potretnya",Clickbait
"7 Hewan yang Memiliki Gigitan Terkuat, Salah Satunya Kuda Nil",Clickbait
Fantastis! Segini Tarif Prostitusi Selebgram-DJ Brazil di Semarang,Clickbait
"10 Momen Crazy Rich Doni Salmanan Menikahi Selebgram, Mas Kawin US$ 15 Ribu",Clickbait
"Viral Moge Polisi Pengawal Jokowi Jatuh di Tanjakan Menikung, Kok Bisa?",Clickbait
"6 Pesona Luna Maya saat Cosplay, Bergaya Pengantin Malah Ditanya Soal Jodoh",Clickbait
"Viral Motor Polisi Pengawal Jokowi Jatuh, Ini Cara Berkendara Moge di Tanjakan yang Menikung",Clickbait
"Pengendara Motor Ditilang Karena Kawal Ambulans, Begini Penjelasan Polisi",Clickbait
Andi Mallarangeng Ungkap Moeldoko Siap Rebut 360 DPC dan DPD Partai Demokrat dari AHY,NonClickbait
Politisi NasDem: Moeldoko Belum Masuk List Capres,NonClickbait
"Tekan Mobilitas Warga, Kota Bogor Berlakukan Sistem Ganjil Genap",NonClickbait
"Masih Ingat dengan Waode Sofia yang Dulu Diusir Iis Dahlia, Begini Kabar Terbarunya",Clickbait
Kemenag Minta Perguruan Tinggi Islam Terapkan Digital University di Masa Pandemi Covid-19,NonClickbait
"BMKG Peringatan Dini Cuaca Ekstrem Minggu, 7 Februari 2021: DKI Jakarta Hujan Lebat Angin Kencang",NonClickbait
Kasus Dugaan Mesum Janda dengan Pria Beristri & Beranak Empat di Aceh Berujung Pernikahan,NonClickbait
"Peringatan Dini BMKG Minggu, 7 Februari 2021: Waspada Cuaca Ekstrem di 23 Wilayah",NonClickbait
"Hukuman Disunat Lewat Putusan PK Mahkamah Agung, Anas Urbaningrum Bebas di 2022",NonClickbait
Ketua PHRI Badung Ungkap Fakta Ada 60 Hotel di Bali On Sale karena Pandemi Covid-19,NonClickbait
Ngeri! Zlatan Ibrahimovic Tunjukkan Foto Cedera Lututnya 3 Bulan yang Lalu,Clickbait
"Temukan Guru Tak Pakai Masker Saat Mengajar, Ini yang Dilakukan Gibran",Clickbait
"Xiaomi Ungkap Desain Kacamata Pintar Pertama, Apa Kecanggihannya?",Clickbait
"Viral Wanita Dulu Tinggal di Rumah Bantuan Tsunami, Kini Punya Rumah Mewah",Clickbait
"Penjual Gorengan Histeris Bongkar Tabungan, Total Uangnya Bikin Melotot",Clickbait
"5 Kasus Penyerangan terhadap Ustaz, Nomor 3 Mungkin Bikin Anda Merinding",Clickbait
"Merinding! Cerita Misteri Apartemen Angker di Surabaya",Clickbait
"Viral Wanita Difoto Sosok Misterius saat Tidur, Kisahnya Bikin Merinding",Clickbait
"Model Ini Idap Penyakit Misterius, Jual Konten Seksi Demi Bayar Pengobatan",Clickbait
"Garuda Indonesia Angkut Macan Tutul Salju dari Belanda, Dibawa ke Malang",NonClickbait
"Warga Sarankan Pemerintah Subsidi GeNose untuk Screening Covid-19, Dinilai Lebih Mudah dan Murah",NonClickbait
"Dikira Musuhnya, 10 Anggota Geng Keroyok 2 Pelajar, Korban Terkena Sabetan Gir dan Pedang",NonClickbait
"Dapat Kado Buket Uang hingga Mobil, Wanita Ini Ungkap Sosok Pacarnya: Suka Tiba-tiba Kasih Kejutan",Clickbait
"Kasus Pembunuhan Pedagang Wanita di Denpasar Terungkap, Korban Tak Bayar Utang Rp 515 Ribu",NonClickbait
"Info BMKG: Peringatan Dini Cuaca Ekstrem Besok, Minggu 7 Februari 2021",NonClickbait
"Prabowo Kukuhkan 12 Waketum, Sufmi Dasco Ketua Harian Partai Gerindra",NonClickbait
"Tips Memilih Semangka yang Manis, Apa yang Harus Diperhatikan?",Clickbait
Empat Wilayah Ini Berpotensi Alami Tsunami Nontektonik,Clickbait
Terkuak! Ini Motif Aksi Sadis Anak Bunuh Ibu Kandung di Cilacap,Clickbait
Misteri Rusaknya Puluhan Makam di Banyuwangi Akhirnya Terkuak,Clickbait
Andai Gol Ronaldo di Laga Terakhir Bareng Juventus Tak Dianulir,NonClickbait
"Sosok Maman Suryadi, Pengawal HRS yang Bantu Irjen Napoleon Aniaya Kace",Clickbait
"Parah! Saking Nggak Ada Duitnya, Evergrande Sampe Ngutang ke Karyawan",Clickbait
Runutan Persoalan Warkopi yang Kena Tegur Indro Warkop,NonClickbait
"Tak Ada Level 4, Ini Daftar Daerah Terapkan PPKM Level 2-3 di Jawa-Bali",Clickbait
Apakah Suntikan Booster atau Dosis Ketiga Vaksin Covid-19 Benar-Benar Diperlukan?,Clickbait
"Wujud Asli Nintendo Switch OLED Muncul di Publik, Langsung Heboh",Clickbait
"Sirkuit Mandalika Gelar WSBK, Berapa Banyak Penonton Boleh Datang?",Clickbait
"Terkuak Alasan Kenapa Erick Susah Banget Tutup BUMN 'Zombie'",NonClickbait
"Model Terbaru Toyota Avanza Mulai Terkuak, Simak Bocorannya",Clickbait
"Terkuak! Giring 'Nidji' Sengaja Serang Anies Baswedan untuk Cari Perhatian",Clickbait
"Terkuak, Ini Strategi KPU dalam Penyelenggaraan Pemilu 2024",Clickbait
Terkuak! soal 'Bapak Asuh' Azis Syamsuddin dari Sidang Eks Penyidik KPK,Clickbait
"Duh, Pak Walkot! Bisa-bisanya Bikin Kerumunan, Paksa Masuk Pantai yang Tutup",Clickbait
"10 Cara Mudah Agar Kamu Bangun dalam Kondisi Segar, Bugar, dan Berenergi",Clickbait
"3 FAKTA Baru Pembunuhan Ibu dan Anak, Bercak Darah di Jaket hingga Sidik Jari Yosef di Lokasi",Clickbait
Ini Gaya Sederhana Rizky Billar Saat Menikahi Siri Lesti Kejora,Clickbait
"8 Potret Jadul Artis Tanah Air saat Masih Kuliah, Ada yang Beda Banget",Clickbait
6 Tips Menata Ruang Kerja untuk Meningkatkan Karier Menurut Feng Shui,Clickbait
"Viral Video Hiu Gigit Kabel Jadi Penyebab Gangguan IndiHome, Ini Faktanya",Clickbait
"5 Fakta Remaja Habisi Ibu Kandung di Jepara, Korban Minta Pelaku Berbohong untuk Tutupi Kejahatannya",Clickbait
Alasan Capaian Vaksinasi di Serang Rendah hingga Disorot Jokowi: Kurang Vaksinator,NonClickbait
"Kisah Cinta Wanita Ini Penuh Drama, Merantau Kemana-mana Jodohnya sama Tetangga",Clickbait
4 Hal yang Bisa Jadi Tanda Bahaya Ketika Jantung Tidak Bekerja dengan Baik,Clickbait
Fakta-fakta Ibu Tiri Sewa Pembunuh Bayaran Habisi Bocah SD di Indramayu,NonClickbait
Ini Kata BNN Soal Digagalkannya Peredaran 100 Kg Sabu di Rokan Hilir,Clickbait
Legenda Arsenal Iri dengan Leicester City karena....,Clickbait
Alasan Kemenkes Hentikan Sementara Penggunaan Vaksin AstraZeneca CTMAV547,NonClickbait
Heboh Dele Alli Kepergok Cium Putri Guardiola,Clickbait
"Anak di Bawah 12 Tahun Boleh Masuk Mal meski Belum Divaksin, Apa Urgensinya?",Clickbait
"Sama-Sama Tentara, Ini Potret Ayah & Sang Putri Dinas di TNI Tapi Beda Negara",Clickbait
"Potret Polwan Diterima 7 Universitas di Inggris Saat Masih Taruna, Cantik & Imut Abis",Clickbait
Ini Moment Kapolres Nganjuk Menangis Teringat Anaknya saat Bertemu Bocah Lumpuh Sejak Lahir,Clickbait
"Info Cuaca BMKG Jabodetabek Besok Minggu 7 Februari 2021: Bogor, Depok & Bekasi Hujan Sepanjang Hari",NonClickbait
Penjelasan BPPTKG Yogyakarta terkait Munculnya Kubah Lava Baru di Tengah Kawah Gunung Merapi,NonClickbait
Bayi Berusia 10 Hari di Jeneponto Meninggal Setelah Terkonfirmasi Positif Covid-19,NonClickbait
"Bocah Tewas Tenggelam di Bekas Galian Pasir, Ibu Korban Histeris",NonClickbait
"Setelah All New BR-V, Honda Mau luncurkan Mobilio atau HR-V Baru? Ini Bocorannya",Clickbait
"Cerita Dokter Koboi Jalani Ujian Tesisi di Rumah Sakit, Ternyata Sudah Dua Kali Terkena Covid-19",NonClickbait
"Prof Firmanzah Wafat, Ibas Sampaikan Ucapan Belasungkawa: Mas Fiz Calon Penguji Program Doktor Saya",NonClickbait
"Info Cuaca Besok Minggu 7 Februari 2021, BMKG: Cuaca Ekstrem di 27 Wilayah",NonClickbait
"Fakta-fakta Mayat Perempuan Tertancap Bambu, Sudah Tewas 3 Hari Lalu dan Identitasnya Terungkap",NonClickbait
Menristek: Indonesia Sudah Harus Kurangi Ketergantungan Bahan Bakar Fosil,NonClickbait
Ana Kaget dan Sempat Tak Percaya Suaminya Meninggal Diserang Harimau Lepas: 'Bohong Saja Kalian',NonClickbait
"Avanza Seruduk Kios dan Pemotor di Tanah Abang, Satu Korban Meninggal Dunia",NonClickbait
"Pengakuan 2 Pegawai Honorer yang Pakai Mobil Dinas untuk Beli Sabu, Biar Kuat Begadang saat Kerja",NonClickbait
"GeNose Resmi Dibuka di Stasiun Senen, Antrean Membludak, Penumpang Tunggu Hasil hingga 2 Jam",NonClickbait
"Fenomena Langka Terjadi di Bali, Astaga!",Clickbait
Topang Perjuangan Keluarga Palestina Melalui Program Sister Family Palestine-Indonesia,NonClickbait
"Diduga Hilang Kendali, Avanza Seruduk Pemotor Hingga Kios Ekspedisi di Tanah Abang",NonClickbait
"Jateng di Rumah Saja, Berikut 8 Ruas Jalan di Pemalang yang Ditutup Mulai Sore Nanti",Clickbait
"Pedagang Wanita Tewas Diduga Dihantam Tabung Gas, Pelakunya Ditangkap di Bondowoso Jatim",NonClickbait
"Anies-Prabowo Lakukan Pertemuan, Pengamat: Bahas Kemungkinan Buat Roadmap Menuju 2024",NonClickbait
"Kebakaran di Kabupaten Barru Sulsel, 7 Rumah Hangus, Seorang Penghuninya Tewas",NonClickbait
"Kabar Orang Pertama yang Dibekukan untuk Dihidupkan Lagi, Sudah 50 Tahun",NonClickbait
Link Live Streaming Liverpool Vs Man City,NonClickbait
"AC Milan Vs Crotone: Ibrahimovic Dua Gol, Rossoneri Menang 4-0",NonClickbait
Tottenham Taklukkan WBA karena Bermain Sabar,NonClickbait
"Ngeri, Perempuan Pemotor Ini Ditabrak Truk dan Terseret hingga 20 Meter",Clickbait
Chelsea di Tangan Thomas Tuchel: Serang Terus!,NonClickbait
"Pesona Kapolsek Termuda Ipda Nadya Ayu Saat Lepas Seragam, Cantiknya Bikin Pusing",Clickbait
"Terungkap! Militer Myanmar Lakukan Pembunuhan Massal Terhadap 40 Laki-laki, Dikubur dalam Satu Liang",Clickbait
Bagaimana Cara Mendapatkan Hak Asuh Anak ketika Bercerai? Begini Kata Advokat,Clickbait
"Viral Potret Bocah jadi 'Mata' Orangtua yang Tunanetra, Lihatnya Bikin Nangis",Clickbait
"6 Resep Masakan yang Dibuat Pakai Rice Cooker, Praktis & Cocok untuk Anak Kos",Clickbait
"Catat, Ini Biaya Resmi Ganti Warna Pelat Nomor Kendaraan",Clickbait
"Plt Walkot Jaksel Sebut Warga Pejaten Timur Tak Masalah Banjir, Tidur di Pasar",NonClickbait
"Kali Ciliwung Meluap, 5 RW di Kampung Melayu Jaktim Terendam Banjir",NonClickbait
"Terbuang dari Juventus, Perin Tampil Gemilang Bersama Genoa",NonClickbait
"Ridho Rhoma, Sang Pangeran Dangdut dalam Pusaran Mirasantika",NonClickbait
"Dibacok Saat Berhubungan Intim, Sejoli di Sidoarjo Bersimbah Darah",NonClickbait
"Foto: Transformasi Melly Goeslaw Kini Langsing, dari XXL Jadi M",NonClickbait
Selandia Baru yang Masih Ingin 'Tutup Pagar' Sepanjang Tahun,NonClickbait
Mobil Presiden Jokowi yang Terjang Banjir di Kalsel Jadi Buruan di AS,NonClickbait
"Suhu Ruangan Pengaruhi Orgasme Pada Wanita, Lebih Baik Dingin atau Panas?",Clickbait
Ini Cara Singapura Buka Pariwisata dengan Aman,Clickbait
"Viral Ibu Teriak Histeris saat Pulang Rumah, Lihat Kamar Tidur Sudah Jadi Begini",Clickbait
"Unggah Foto Seksi, Salmafina Pamer Berat Badan yang Turun 8 Kg",NonClickbait
"Meninggal Tepat Setahun Lalu, Whistle Blower Virus Corona Dapat Penghormatan",NonClickbait
"Vaksin Sinovac Bisa Dipakai Lansia, Amankah untuk 70 Tahun ke Atas?",Clickbait
"5 Transformasi Berat Badan Artis yang Menakjubkan, Melly Goeslaw Susut 9 Kg",Clickbait
Wajah Wanita Ini Berakhir Rusak dan Bersisik Usai Pakai Krim Eczema,Clickbait
"Warga Kalipucang Pangandaran Geger, Bayi Perempuan Ditemukan di Dalam Masjid",Clickbait
Geger 2 Gundukan Mirip Makam di Tengah Anak Sungai Bengawan Solo di Klaten,Clickbait
"Link Live Streaming Sheffield United Vs Chelsea, Kick-off 02.15 WIB",NonClickbait
"Liverpoool Vs Man City, Penalti Gagal Guendogan Warnai Alotnya Babak Pertama",NonClickbait
Kata-kata Zlatan Ibrahimovic Usai Cetak Gol ke-501 di Level Klub,NonClickbait
"VIDEO - Gol ke-500 Zlatan Ibrahimovic, Bikin Tim Promosi Tak Berkutik",NonClickbait
Doa Bersama dari Kendari untuk Bangsa,NonClickbait
"Bantu Spurs Tekuk West Brom, Harry Kane Jadi Pangeran Gol The Lilywhites",NonClickbait
Leon Spinks Legenda Tinju yang Pernah Kalahkan Muhamad Ali Meninggal Dunia,NonClickbait
"Kane Langsung Cetak Gol Usai Cedera, Mourinho Ucapkan Kata Spesial",NonClickbait
"Pasien Covid-19 Melahirkan Saat Koma, Baru Bertemu Bayinya 75 Hari Kemudian",NonClickbait
Satu Skill Neymar yang Paling Ingin Dimiliki Kylian Mbappe,NonClickbait
"Line Up Liverpool Vs Man City, Alisson dan Mane Kembali",NonClickbait
"Masuk Rumah Janda Pakai Kolor, Pria Ini Menangis Histeris saat Ditangkap Warga",Clickbait
"Tottenham Vs West Brom, Rindu Son Heung-min Terhadap Kane Terbayar",NonClickbait
Paus Fransiskus Angkat Bicara soal Kudeta Myanmar dan Panjatkan Doa,NonClickbait
"AC Milan Vs Crotone, Rekor 501 Gol Ibrahimovic Warnai Pesta Rossoneri",NonClickbait
Warga Belum Menyiapkan Rencana Darurat meski Terdampak Banjir,NonClickbait
Ngeri! Ibu di Sumsel Dirampok-Diancam Ditembak Saat Naik Motor Bareng Anak,Clickbait
"Link Live Streaming Real Betis Vs Barcelona, Kick-off 03.00 WIB",NonClickbait
Iran Tak Akan Patuhi Perjanjian Nuklir Sebelum AS Cabut Sanksi,NonClickbait
Hasil Liga Italia - Gol Spesial Ibrahimovic Kirim AC Milan Balik ke Puncak,NonClickbait
"Hasil AC Milan Vs Crotone, Rossoneri Kembali ke Puncak Usai Berpesta",NonClickbait
Tekad Evan Dimas Usai Kembali Dipanggil Shin Tae-yong ke Timnas U22 Indonesia,NonClickbait
Polisi Bubarkan Kerumunan Klub Motor di Bendungan Pengge Lombok Tengah,NonClickbait
"Kapasitas Pompa Tak Optimal, Banjir di Semarang Lama Surut",NonClickbait
BPOM Keluarkan Izin Pemberian Vaksin Covid-19 untuk Lansia,NonClickbait
Benarkah Vaksinasi Covid-19 di Indonesia Diprediksi Baru Selesai 10 Tahun?,Clickbait
"Junta Militer Blokir Internet, Puluhan Ribu Warga Myanmar Demo Tolak Kudeta Militer",NonClickbait
"Diterpa Isu Kudeta, Pengurus Partai Demokrat Puji Kepemimpinan AHY",NonClickbait
"Rincian Besaran Gaji PNS di 2021, Direncanakan Hanya Tersisa Gaji Pokok dan Tunjangan",NonClickbait
"Pelarian Istri Pembakar Suami Berakhir di Semarang, Aksi Kejinya Dilandasi Dendam",NonClickbait
Peneliti LIPI: Pemilu Diselenggarakan Borongan di 2024 Itu Nggak Realistis,NonClickbait
"51 Napi Lapas Sukamiskin Positif Corona, Begini Tanggapan Dirjen PAS",Clickbait
Geger Mayat Sejoli di Kawasan Wisata Pantai Cibendo Karawang,Clickbait
Cerita di Balik 1.000 Pemuda Asli Papua yang Direkrut Jadi Prajurit TNI AD,NonClickbait
"Wow, Popularitas Partai Demokrat dan AHY Melejit Sejak Kasus Kudeta Terkuak",Clickbait
"Ditawari Kerjaan, Motor hingga Perhiasan Ibu Muda Ini Malah Dibawa Kabur Pria Kenalannya di Facebook",Clickbait
"Dulu Digerebek saat Berduaan dengan Anggota Dewan, PNS Ini Kini Ditangkap karena Penipuan",Clickbait
Apa Urgensinya Revisi UU Pemilu Saat Ini? Berikut Pandangan Pengamat,Clickbait
Andi Mallarangeng: Kalau Moeldoko Mau Didukung jadi Capres 2024 Datang Baik-baik ke SBY,NonClickbait
"FAKTA Pasutri Meninggal Hampir Bersamaan, Suami Tak Sadarkan Diri Setelah Baca Yasin untuk Istrinya",NonClickbait
Buronan Kasus Korupsi Sejak 2013 Ini Ditangkap di Daerah Bintaro,Clickbait
Izin Darurat Vaksin Sinovac Bagi Lansia Telah Melalui Uji Klinik di China dan Brazil,NonClickbait
Pecahnya Kongsi Partai Berkarya Versi Kubu Muchdi PR Diibaratkan dengan Istilah Jawa Ini,Clickbait
"Lubangi Tembok, Maling Berhasil Bobol Minimarket, Uang Puluhan Juta Raib Dibawa Kabur",NonClickbait
"Fakta Baru Kasus Wanita Tewas Tertancap Bambu, Korban Dibunuh oleh Pacarnya Sendiri",NonClickbait
"Sejoli Mahasiswa Nekat Curi Televisi di Tempatnya Menginap, Ngaku untuk Main Game di Kos",NonClickbait
"Berduaan di Mobil, Imam Kampung Beristri dan Janda 4 Anak Dinikahkan, Maskawin Uang Rp 200 Ribu",NonClickbait
Astaga! Pria Muda di Jatinegara Gantung Diri Live Lewat TikTok,Clickbait
Benarkah Fadli Zon Terdepak dari Jabatan Wakil Ketum Gerindra? Ini Penjelasan Andre Rosiade,Clickbait
Penjelasan Lengkap Polri soal Ustadz Maaher Meninggal di Rutan Bareskrim,NonClickbait
Pengacara Sebut Ustadz Maaher Sempat Ajukan Pembantaran Sebelum Meninggal,NonClickbait
"Ustadz Maaher Meninggal Dunia, Sakit Apa?",Clickbait
"Astaga! Ayah di Labuhanbatu Paksa Bayi Isap Rokok, Ini Motifnya",Clickbait
"Visa Jangka Panjang Turis Asing, Berlaku 5 Tahun, Setor Deposit Rp 2 Miliar",NonClickbait
"Mau PPKM Mikro, Ini Daftar Daerah Masuk Zona Merah per 7 Februari",Clickbait
"Hotel di Bandung Terancam Bangkrut, Ini Tanggapan Pemkot",Clickbait
Foto: Melihat Cantiknya Nusakambangan dari Pangandaran,NonClickbait
Wanita Susah Klimaks? 4 Variasi Seks Ini Harus Banget Dicoba,Clickbait
"Nindy Ayunda Dibanting Suami, 7 Artis Ini Juga Alami KDRT Saat Menikah",Clickbait
Ingin Mr P Terlihat Lebih Besar? 3 Cara Ini Bisa Dicoba,Clickbait
Potret Kawasan Wisata yang Kabarnya Jadi Tempat Pesugihan,Clickbait
"Dipanggil Shin Tae-yong, Kiper Muda Persib Ungkap Harapan dan Persiapan",NonClickbait
3 Tips dari CT Agar Pebisnis Bertahan di Situasi Sulit Pandemi,Clickbait
"Peluru Ini Jadi Bukti Indonesia Pernah Perang dengan Malaysia, Ditemukan TNI di Hutan",Clickbait
"Potret Persahabatan 2 Jenderal, Bersama Sejak Muda Bernasib Sama Jadi Kapolri",Clickbait
"Lama Menghilang, Begini Potret Terbaru Artis Uli Auliani jadi Top Model di Amerika",Clickbait
Anak Di Atas Usia 2 Tahun Tak Direkomendasikan untuk Konsumsi Susu Formula,NonClickbait
Ngeri! Ribuan Orang Positif Covid Beredar di Mal Cs,Clickbait
"Lihat Potret Nagita Slavina Hingga Iis Dahlia dengan Sang Ibu saat Muda, Kayak Kembar",Clickbait
Orangnya Prabowo Unggah Foto Natalius Pigai Semeja dengan Abu Janda,NonClickbait
Dua Terduga Teroris di Kepulauan Bangka Belitung Ditangkap,NonClickbait
